{
  "research_run_id": "run-2026-07-19-bank-fishing",
  "candidate_id": "nc-001",
  "state": "researching",
  "created_at": "2026-07-19",
  "last_updated_at": "2026-07-19",
  "owner": "example",
  "research_questions": [
    "Is the friction repeated and material?",
    "What independent workarounds exist?",
    "Do current solutions leave a measurable gap?",
    "What evidence would falsify the thesis?"
  ],
  "required_gates": [
    "g1",
    "g2",
    "g3",
    "g4",
    "g5",
    "g6",
    "g7"
  ],
  "blocked_assumptions": [
    "No fabricated metrics",
    "No demand conclusion from one source"
  ],
  "inputs": [
    "data/niche_candidates.csv",
    "data/outdoor_activity_niche_seed.csv"
  ],
  "outputs": [
    "evidence.csv",
    "queries.csv",
    "notes.md"
  ]
}
